{
  "$schema": "https://json-schema.org/draft/2020-12/schema",
  "$id": "data/datasets/250_CMRS_240dpi_20260707/content.schema.json",
  "title": "CMR Content Annotation Output",
  "description": "JSON Schema for the content object used as the VLM target in data/datasets/250_CMRS_240dpi_20260707. The annotation metadata wrapper is intentionally excluded.",
  "type": "object",
  "additionalProperties": false,
  "required": [
    "senderInformation",
    "consigneeInformation",
    "takingOverTheGoods",
    "deliveryOfTheGoods",
    "sendersInstructions",
    "carrierInformation",
    "successiveCarrierInformation",
    "carrierReservationsAndObservations",
    "documentsHandedToCarrier",
    "itemList",
    "signatureOrStampOfTheSender",
    "signatureOrStampOfTheCarrier",
    "goodsReceived",
    "referenceIdentificationNumber"
  ],
  "properties": {
    "senderInformation": {
      "$ref": "#/$defs/sender_information"
    },
    "consigneeInformation": {
      "$ref": "#/$defs/consignee_information"
    },
    "takingOverTheGoods": {
      "$ref": "#/$defs/taking_over_the_goods"
    },
    "deliveryOfTheGoods": {
      "$ref": "#/$defs/delivery_of_the_goods"
    },
    "sendersInstructions": {
      "$ref": "#/$defs/senders_instructions"
    },
    "carrierInformation": {
      "$ref": "#/$defs/carrier_information"
    },
    "successiveCarrierInformation": {
      "$ref": "#/$defs/successive_carrier_information"
    },
    "carrierReservationsAndObservations": {
      "$ref": "#/$defs/carrier_reservations_and_observations"
    },
    "documentsHandedToCarrier": {
      "$ref": "#/$defs/documents_handed_to_carrier"
    },
    "itemList": {
      "type": "array",
      "items": {
        "$ref": "#/$defs/item"
      }
    },
    "signatureOrStampOfTheSender": {
      "$ref": "#/$defs/signature_or_stamp_of_the_sender"
    },
    "signatureOrStampOfTheCarrier": {
      "$ref": "#/$defs/signature_or_stamp_of_the_carrier"
    },
    "goodsReceived": {
      "$ref": "#/$defs/goods_received"
    },
    "referenceIdentificationNumber": {
      "$ref": "#/$defs/nullable_string"
    }
  },
  "$defs": {
    "nullable_string": {
      "type": [
        "string",
        "null"
      ]
    },
    "nullable_string_or_number": {
      "type": [
        "string",
        "number",
        "null"
      ]
    },
    "nullable_string_or_integer": {
      "type": [
        "string",
        "integer",
        "null"
      ]
    },
    "country_code": {
      "type": "object",
      "additionalProperties": false,
      "required": [
        "value"
      ],
      "properties": {
        "value": {
          "$ref": "#/$defs/nullable_string"
        }
      }
    },
    "contact_information": {
      "type": "object",
      "additionalProperties": false,
      "required": [
        "phone"
      ],
      "properties": {
        "phone": {
          "$ref": "#/$defs/nullable_string"
        }
      }
    },
    "sender_information": {
      "type": "object",
      "additionalProperties": false,
      "required": [
        "senderNameCompany",
        "senderStreet",
        "senderPostcode",
        "senderCity",
        "senderCountryCode",
        "senderContactInformation"
      ],
      "properties": {
        "senderNameCompany": {
          "$ref": "#/$defs/nullable_string"
        },
        "senderStreet": {
          "$ref": "#/$defs/nullable_string"
        },
        "senderPostcode": {
          "$ref": "#/$defs/nullable_string"
        },
        "senderCity": {
          "$ref": "#/$defs/nullable_string"
        },
        "senderCountryCode": {
          "$ref": "#/$defs/country_code"
        },
        "senderContactInformation": {
          "$ref": "#/$defs/contact_information"
        }
      }
    },
    "consignee_information": {
      "type": "object",
      "additionalProperties": false,
      "required": [
        "consigneeNameCompany",
        "consigneeStreet",
        "consigneePostcode",
        "consigneeCity",
        "consigneeCountryCode"
      ],
      "properties": {
        "consigneeNameCompany": {
          "$ref": "#/$defs/nullable_string"
        },
        "consigneeStreet": {
          "$ref": "#/$defs/nullable_string"
        },
        "consigneePostcode": {
          "$ref": "#/$defs/nullable_string"
        },
        "consigneeCity": {
          "$ref": "#/$defs/nullable_string"
        },
        "consigneeCountryCode": {
          "$ref": "#/$defs/country_code"
        }
      }
    },
    "taking_over_the_goods": {
      "type": "object",
      "additionalProperties": false,
      "required": [
        "takingOverTheGoodsPlace",
        "logisticsDateOfArrival"
      ],
      "properties": {
        "takingOverTheGoodsPlace": {
          "$ref": "#/$defs/nullable_string"
        },
        "logisticsDateOfArrival": {
          "$ref": "#/$defs/nullable_string"
        }
      }
    },
    "delivery_of_the_goods": {
      "type": "object",
      "additionalProperties": false,
      "required": [
        "logisticsLocationCity"
      ],
      "properties": {
        "logisticsLocationCity": {
          "$ref": "#/$defs/nullable_string"
        }
      }
    },
    "senders_instructions": {
      "type": "object",
      "additionalProperties": false,
      "required": [
        "transportInstructionsDescription"
      ],
      "properties": {
        "transportInstructionsDescription": {
          "$ref": "#/$defs/nullable_string"
        }
      }
    },
    "carrier_information": {
      "type": "object",
      "additionalProperties": false,
      "required": [
        "carrierNameCompany",
        "carrierStreet",
        "carrierPostcode",
        "carrierCity",
        "carrierCountryCode",
        "carrierLicensePlate"
      ],
      "properties": {
        "carrierNameCompany": {
          "$ref": "#/$defs/nullable_string"
        },
        "carrierStreet": {
          "$ref": "#/$defs/nullable_string"
        },
        "carrierPostcode": {
          "$ref": "#/$defs/nullable_string"
        },
        "carrierCity": {
          "$ref": "#/$defs/nullable_string"
        },
        "carrierCountryCode": {
          "$ref": "#/$defs/country_code"
        },
        "carrierLicensePlate": {
          "$ref": "#/$defs/nullable_string"
        }
      }
    },
    "successive_carrier_information": {
      "type": "object",
      "additionalProperties": false,
      "required": [
        "successiveCarrierNameCompany",
        "successiveCarrierStreet",
        "successiveCarrierPostcode",
        "successiveCarrierCity",
        "successiveCarrierCountryCode"
      ],
      "properties": {
        "successiveCarrierNameCompany": {
          "$ref": "#/$defs/nullable_string"
        },
        "successiveCarrierStreet": {
          "$ref": "#/$defs/nullable_string"
        },
        "successiveCarrierPostcode": {
          "$ref": "#/$defs/nullable_string"
        },
        "successiveCarrierCity": {
          "$ref": "#/$defs/nullable_string"
        },
        "successiveCarrierCountryCode": {
          "$ref": "#/$defs/country_code"
        }
      }
    },
    "carrier_reservations_and_observations": {
      "type": "object",
      "additionalProperties": false,
      "required": [
        "carrierReservationsObservations"
      ],
      "properties": {
        "carrierReservationsObservations": {
          "$ref": "#/$defs/nullable_string"
        }
      }
    },
    "documents_handed_to_carrier": {
      "type": "object",
      "additionalProperties": false,
      "required": [
        "documentsRemarks"
      ],
      "properties": {
        "documentsRemarks": {
          "$ref": "#/$defs/nullable_string"
        }
      }
    },
    "item": {
      "type": "object",
      "additionalProperties": false,
      "required": [
        "marksAndNos",
        "numberOfPackages",
        "methodOfPacking",
        "natureOfTheGoods",
        "grossWeightInKg"
      ],
      "properties": {
        "marksAndNos": {
          "$ref": "#/$defs/marks_and_nos"
        },
        "numberOfPackages": {
          "$ref": "#/$defs/number_of_packages"
        },
        "methodOfPacking": {
          "$ref": "#/$defs/method_of_packing"
        },
        "natureOfTheGoods": {
          "$ref": "#/$defs/nature_of_the_goods"
        },
        "grossWeightInKg": {
          "$ref": "#/$defs/gross_weight_in_kg"
        }
      }
    },
    "marks_and_nos": {
      "type": "object",
      "additionalProperties": false,
      "required": [
        "logisticsShippingMarksMarkings"
      ],
      "properties": {
        "logisticsShippingMarksMarkings": {
          "$ref": "#/$defs/nullable_string"
        }
      }
    },
    "number_of_packages": {
      "type": "object",
      "additionalProperties": false,
      "required": [
        "logisticsPackageItemQuantity"
      ],
      "properties": {
        "logisticsPackageItemQuantity": {
          "$ref": "#/$defs/nullable_string_or_integer"
        }
      }
    },
    "method_of_packing": {
      "type": "object",
      "additionalProperties": false,
      "required": [
        "logisticsPackageType"
      ],
      "properties": {
        "logisticsPackageType": {
          "$ref": "#/$defs/nullable_string"
        }
      }
    },
    "nature_of_the_goods": {
      "type": "object",
      "additionalProperties": false,
      "required": [
        "transportCargoIdentification"
      ],
      "properties": {
        "transportCargoIdentification": {
          "$ref": "#/$defs/nullable_string"
        }
      }
    },
    "gross_weight_in_kg": {
      "type": "object",
      "additionalProperties": false,
      "required": [
        "supplyChainConsignmentItemGrossWeight"
      ],
      "properties": {
        "supplyChainConsignmentItemGrossWeight": {
          "$ref": "#/$defs/nullable_string_or_number"
        }
      }
    },
    "sender_signature": {
      "type": "object",
      "additionalProperties": false,
      "required": [
        "userCompany",
        "userStreet",
        "userPostCode",
        "userCity"
      ],
      "properties": {
        "userCompany": {
          "$ref": "#/$defs/nullable_string"
        },
        "userStreet": {
          "$ref": "#/$defs/nullable_string"
        },
        "userPostCode": {
          "$ref": "#/$defs/nullable_string_or_integer"
        },
        "userCity": {
          "$ref": "#/$defs/nullable_string"
        }
      }
    },
    "carrier_signature": {
      "type": "object",
      "additionalProperties": false,
      "required": [
        "userCompany",
        "userStreet",
        "userPostCode",
        "userCity",
        "userCountry",
        "date"
      ],
      "properties": {
        "userCompany": {
          "$ref": "#/$defs/nullable_string"
        },
        "userStreet": {
          "$ref": "#/$defs/nullable_string"
        },
        "userPostCode": {
          "$ref": "#/$defs/nullable_string_or_integer"
        },
        "userCity": {
          "$ref": "#/$defs/nullable_string"
        },
        "userCountry": {
          "$ref": "#/$defs/nullable_string"
        },
        "date": {
          "$ref": "#/$defs/nullable_string"
        }
      }
    },
    "consignee_signature": {
      "type": "object",
      "additionalProperties": false,
      "required": [
        "userCompany",
        "userStreet",
        "userPostCode",
        "userCity",
        "date"
      ],
      "properties": {
        "userCompany": {
          "$ref": "#/$defs/nullable_string"
        },
        "userStreet": {
          "$ref": "#/$defs/nullable_string"
        },
        "userPostCode": {
          "$ref": "#/$defs/nullable_string_or_integer"
        },
        "userCity": {
          "$ref": "#/$defs/nullable_string"
        },
        "date": {
          "$ref": "#/$defs/nullable_string"
        }
      }
    },
    "signature_or_stamp_of_the_sender": {
      "type": "object",
      "additionalProperties": false,
      "required": [
        "senderSignature"
      ],
      "properties": {
        "senderSignature": {
          "$ref": "#/$defs/sender_signature"
        }
      }
    },
    "signature_or_stamp_of_the_carrier": {
      "type": "object",
      "additionalProperties": false,
      "required": [
        "carrierSignature"
      ],
      "properties": {
        "carrierSignature": {
          "$ref": "#/$defs/carrier_signature"
        }
      }
    },
    "goods_received": {
      "type": "object",
      "additionalProperties": false,
      "required": [
        "consigneeSignature"
      ],
      "properties": {
        "consigneeSignature": {
          "$ref": "#/$defs/consignee_signature"
        }
      }
    }
  }
}
