{
  "senderInformation": {
    "senderNameCompany": null,
    "senderStreet": null,
    "senderPostcode": null,
    "senderCity": null,
    "senderCountryCode": {
      "value": null
    },
    "senderContactInformation": {
      "phone": null
    }
  },
  "consigneeInformation": {
    "consigneeNameCompany": null,
    "consigneeStreet": null,
    "consigneePostcode": null,
    "consigneeCity": null,
    "consigneeCountryCode": {
      "value": null
    }
  },
  "takingOverTheGoods": {
    "takingOverTheGoodsPlace": null,
    "logisticsDateOfArrival": null
  },
  "deliveryOfTheGoods": {
    "logisticsLocationCity": null
  },
  "sendersInstructions": {
    "transportInstructionsDescription": null
  },
  "carrierInformation": {
    "carrierNameCompany": null,
    "carrierStreet": null,
    "carrierPostcode": null,
    "carrierCity": null,
    "carrierCountryCode": {
      "value": null
    },
    "carrierLicensePlate": null
  },
  "successiveCarrierInformation": {
    "successiveCarrierNameCompany": null,
    "successiveCarrierStreet": null,
    "successiveCarrierPostcode": null,
    "successiveCarrierCity": null,
    "successiveCarrierCountryCode": {
      "value": null
    }
  },
  "carrierReservationsAndObservations": {
    "carrierReservationsObservations": null
  },
  "documentsHandedToCarrier": {
    "documentsRemarks": null
  },
  "itemList": [
    {
      "marksAndNos": {
        "logisticsShippingMarksMarkings": null
      },
      "numberOfPackages": {
        "logisticsPackageItemQuantity": null
      },
      "methodOfPacking": {
        "logisticsPackageType": null
      },
      "natureOfTheGoods": {
        "transportCargoIdentification": null
      },
      "grossWeightInKg": {
        "supplyChainConsignmentItemGrossWeight": null
      }
    }
  ],
  "signatureOrStampOfTheSender": {
    "senderSignature": {
      "userCompany": null,
      "userStreet": null,
      "userPostCode": null,
      "userCity": null
    }
  },
  "signatureOrStampOfTheCarrier": {
    "carrierSignature": {
      "userCompany": null,
      "userStreet": null,
      "userPostCode": null,
      "userCity": null,
      "userCountry": null,
      "date": null
    }
  },
  "goodsReceived": {
    "consigneeSignature": {
      "userCompany": null,
      "userStreet": null,
      "userPostCode": null,
      "userCity": null,
      "date": null
    }
  },
  "referenceIdentificationNumber": null
}
